{  "$schema": "https://json-schema.org/draft/2020-12/schema",  "$id": "https://proofable.local/schema/manifest.json",  "title": "Proofable Manifest v0.1",  "type": "object",  "required": [    "version",    "subject",    "content",    "bom",    "license",    "issuer",    "signature",    "created"  ],  "properties": {    "version": {      "type": "string",      "const": "0.1"    },    "subject": {      "type": "object",      "required": [        "type",        "id"      ],      "properties": {        "type": {          "type": "string",          "enum": [            "model",            "agent",            "robot"          ]        },        "id": {          "type": "string"        }      }    },    "content": {      "type": "object",      "required": [        "hash_alg",        "hash",        "size_bytes",        "merkle_root",        "chunk_size"      ],      "properties": {        "hash_alg": {          "type": "string",          "enum": [            "sha256"          ]        },        "hash": {          "type": "string"        },        "size_bytes": {          "type": "integer",          "minimum": 0        },        "merkle_root": {          "type": "string"        },        "chunk_size": {          "type": "integer",          "minimum": 262144        }      }    },    "bom": {      "type": "array",      "items": {        "type": "object",        "required": [          "name",          "type",          "uri"        ],        "properties": {          "name": {            "type": "string"          },          "type": {            "type": "string",            "enum": [              "dataset",              "code",              "weights",              "doc"            ]          },          "uri": {            "type": "string"          }        }      }    },    "license": {      "type": "string"    },    "safety_card_uri": {      "type": "string"    },    "issuer": {      "type": "object",      "required": [        "name",        "key_alg",        "pubkey"      ],      "properties": {        "name": {          "type": "string"        },        "key_alg": {          "type": "string",          "enum": [            "ed25519"          ]        },        "pubkey": {          "type": "string"        }      }    },    "created": {      "type": "string"    },    "expires": {      "type": "string"    },    "signature": {      "type": "object",      "required": [        "alg",        "sig"      ],      "properties": {        "alg": {          "type": "string",          "enum": [            "ed25519"          ]        },        "sig": {          "type": "string"        }      }    }  }}