{  "version": "0.1",  "subject": {    "type": "model",    "id": "09d8f815-adb7-49dc-82bd-dc842f753073"  },  "content": {    "hash_alg": "sha256",    "hash": "70fc65cf48afd460a4805c18f77529e9a7b5b547a3e80cde1a19524c24031836",    "size_bytes": 52428800,    "merkle_root": "beac36869990ec29ccdd704ef73e5d3e6e3ffd9db14c263e00bccd99fd760de4",    "chunk_size": 1048576  },  "bom": [    {      "name": "dummy_model.bin",      "type": "weights",      "uri": "file:///mnt/data/proofable_lvk/dummy_model.bin"    }  ],  "license": "Proprietary",  "safety_card_uri": "",  "issuer": {    "name": "Proofable Demo Issuer",    "key_alg": "ed25519",    "pubkey": "9RoWWc3TNZ3rj21wXqKePhAa8Wxwj/21Bd3aDonRry4="  },  "created": "2025-09-07T16:27:14.496813Z",  "expires": "",  "signature": {    "alg": "ed25519",    "sig": "Jc5pfl/OPdmEDCfPOrtK2IHOooMCk9dO3ksAOynNS/MG5u+J6RbRQlHK17WPFVWBOvA7LZ0vjYxziCJFzZFqAQ=="  }}